세션,요일,강의 시간,강의 제목,세부 주제
1,토요일,3시간,JSHA 개요 및 핵심 철학,"교육 과정 소개 및 학습 로드맵, JSHA 통증 치료 철학 (불균형-보상-통증), JSST 이해 및 활용 실습, Q&A 및 네트워킹"
1,일요일,7시간,JSST 및 JS Insole 실습,"JSHA 과학적 근거, X-ray 분석 기초, JSST 및 이학적 검사, JS Insole의 원리와 적용, JS 주사치료, DTR 시연 및 실습"
2,토요일,3시간,JSST 및 Insole 적용 복습,"수강생 임상 적용 사례 공유, 1:1 테스트 및 피드백, JSST 및 JS Insole 검사 실습"
2,일요일,7시간,DTR & STR 마스터,"DTR (Dural Tension Release) 실습, STR (Segmental Tension Release) 이론 및 실습, 호흡 및 발가락락 기능 재활 교육 이론 및 실습, JS core routine 1,2 시연 및 실습"
3,토요일,3시간,DTR & STR 집중 복습,"1:1 테스트 및 피드백, DTR & STR 복습 및 실습, 수강생 임상 적용 사례 공유, 문제 해결 워크숍"
3,일요일,7시간,Advance Technique (고급 기법),"PTR (Peripheral Tension Release) 시연 및 실습, 주요 부위별 치료 프로토콜 (상지/하지), PTR 및 호흡/발가락 기능 재활 교육 실습, 한 단계 더 나아간 JSHA 치료 테크닉 (비기)"
4,토요일,3시간,DTR, STR, PTR 집중 실습,"1:1 테스트 및 피드백, DTR, STR, PTR 실습, 호흡 및 발가락 재활 실습, JS core routine 실습"
4,일요일,7시간,JS 증례 발표 및 토론,"JSHA 완전 마스터, 환자 증례 발표 (참가자), 종합 토론 및 피드백, 최종 Q&A 세션, 수료식 및 네트워킹"
